mysql> show databases;
+--------------------+
| Database           |
+--------------------+
| information_schema |
| mysql              |
| payrollservice     |
| performance_schema |
| sakila             |
| sys                |
| world              |
+--------------------+
7 rows in set (0.00 sec)

mysql> create database addressbookservice;
Query OK, 1 row affected (0.04 sec)

mysql> show databases;
+--------------------+
| Database           |
+--------------------+
| addressbookservice |
| information_schema |
| mysql              |
| payrollservice     |
| performance_schema |
| sakila             |
| sys                |
| world              |
+--------------------+
8 rows in set (0.00 sec)

mysql> use addressbookservice ;
Database changed

mysql> show TABLES;
Empty set (0.00 sec)

mysql> create table addressbook(FirstName varchar(150), Lastname varchar(150), Address varchar(255), City varchar(255), State varchar(255), Zip INT, PhoneNumber LONG, Email varchar(255));
Query OK, 0 rows affected (0.17 sec)

mysql> show TABLES;
+------------------------------+
| Tables_in_addressbookservice |
+------------------------------+
| addressbook                  |
+------------------------------+
1 row in set (0.00 sec)

mysql> describe addressbook;
+-------------+--------------+------+-----+---------+-------+
| Field       | Type         | Null | Key | Default | Extra |
+-------------+--------------+------+-----+---------+-------+
| FirstName   | varchar(150) | YES  |     | NULL    |       |
| Lastname    | varchar(150) | YES  |     | NULL    |       |
| Address     | varchar(255) | YES  |     | NULL    |       |
| City        | varchar(255) | YES  |     | NULL    |       |
| State       | varchar(255) | YES  |     | NULL    |       |
| Zip         | int          | YES  |     | NULL    |       |
| PhoneNumber | mediumtext   | YES  |     | NULL    |       |
| Email       | varchar(255) | YES  |     | NULL    |       |
+-------------+--------------+------+-----+---------+-------+
8 rows in set (0.08 sec)

mysql> insert into addressbook(FirstName, LastName, Address, City, State, Zip, PhoneNumber, Email) values ("Raj", "Kumar", "AnnaNagar", "Chennai", "TamilNadu", 600024, '8563214590', "rajrj123@gmail.com");
Query OK, 1 row affected (0.05 sec)

mysql> insert into addressbook(FirstName, LastName, Address, City, State, Zip, PhoneNumber, Email) values ("Ram", "Kumar", "IndiraNagar", "Bangalore", "Karnataka", 530068, '7894562456', "ramrk@gmail.com");
Query OK, 1 row affected (0.04 sec)

mysql> select * from addressbook;
+-----------+----------+-------------+-----------+-----------+--------+-------------+--------------------+
| FirstName | Lastname | Address     | City      | State     | Zip    | PhoneNumber | Email
  |
+-----------+----------+-------------+-----------+-----------+--------+-------------+--------------------+
| Raj       | Kumar    | AnnaNagar   | Chennai   | TamilNadu | 600024 | 8563214590  | rajrj123@gmail.com |
| Ram       | Kumar    | IndiraNagar | Bangalore | Karnataka | 530068 | 7894562456  | ramrk@gmail.com    |
+-----------+----------+-------------+-----------+-----------+--------+-------------+--------------------+
2 rows in set (0.00 sec)

mysql> UPDATE addressbook set FirstName = "Jakson", LastName = "Percy" WHERE(FirstName = "Raj");
Query OK, 1 row affected (0.10 sec)
Rows matched: 1  Changed: 1  Warnings: 0

mysql> select * from addressbook;
+-----------+----------+-------------+-----------+-----------+--------+-------------+--------------------+
| FirstName | Lastname | Address     | City      | State     | Zip    | PhoneNumber | Email
   |
+-----------+----------+-------------+-----------+-----------+--------+-------------+--------------------+
| Jakson    | Percy    | AnnaNagar   | Chennai   | TamilNadu | 600024 | 8563214590  | rajrj123@gmail.com |
| Ram       | Kumar    | IndiraNagar | Bangalore | Karnataka | 530068 | 7894562456  | ramrk@gmail.com    |
+-----------+----------+-------------+-----------+-----------+--------+-------------+--------------------+
2 rows in set (0.00 sec)mysql> UPDATE addressbook set FirstName = "Jakson", LastName = "Percy" WHERE(FirstName = "Raj");
Query OK, 1 row affected (0.10 sec)
Rows matched: 1  Changed: 1  Warnings: 0

mysql> select * from addressbook;
+-----------+----------+-------------+-----------+-----------+--------+-------------+--------------------+
| FirstName | Lastname | Address     | City      | State     | Zip    | PhoneNumber | Email
   |
+-----------+----------+-------------+-----------+-----------+--------+-------------+--------------------+
| Jakson    | Percy    | AnnaNagar   | Chennai   | TamilNadu | 600024 | 8563214590  | rajrj123@gmail.com |
| Ram       | Kumar    | IndiraNagar | Bangalore | Karnataka | 530068 | 7894562456  | ramrk@gmail.com    |
+-----------+----------+-------------+-----------+-----------+--------+-------------+--------------------+
2 rows in set (0.00 sec)

mysql> insert into addressbook(FirstName, LastName, Address, City, State, Zip, PhoneNumber, Email) values ("Dani", "Don", "RajajiNagar", "Bangalore", "Karnataka", 530064, '9875641320', "ddrj123@gmail.com");
Query OK, 1 row affected (0.06 sec)

mysql> insert into addressbook(FirstName, LastName, Address, City, State, Zip, PhoneNumber, Email) values ("Preeti", "Singh", "FrazerTown", "Vizag", "AndraPradesh", 4000256, '7854695236', "psft288@gmail.com");
Query OK, 1 row affected (0.04 sec)

mysql> select * from addressbook;
+-----------+----------+-------------+-----------+--------------+---------+-------------+--------------------+
| FirstName | Lastname | Address     | City      | State        | Zip     | PhoneNumber | Email              |
+-----------+----------+-------------+-----------+--------------+---------+-------------+--------------------+
| Jakson    | Percy    | AnnaNagar   | Chennai   | TamilNadu    |  600024 | 8563214590  | rajrj123@gmail.com |
| Ram       | Kumar    | IndiraNagar | Bangalore | Karnataka    |  530068 | 7894562456  | ramrk@gmail.com    |
| Dani      | Don      | RajajiNagar | Bangalore | Karnataka    |  530064 | 9875641320  | ddrj123@gmail.com  |
| Preeti    | Singh    | FrazerTown  | Vizag     | AndraPradesh | 4000256 | 7854695236  | psft288@gmail.com  |
+-----------+----------+-------------+-----------+--------------+---------+-------------+--------------------+
4 rows in set (0.00 sec)

mysql> delete from addressbook where(FirstName = "Jakson");
Query OK, 1 row affected (0.05 sec)

mysql> select * from addressbook;
+-----------+----------+-------------+-----------+--------------+---------+-------------+-------------------+
| FirstName | Lastname | Address     | City      | State        | Zip     | PhoneNumber | Email             |
+-----------+----------+-------------+-----------+--------------+---------+-------------+-------------------+
| Ram       | Kumar    | IndiraNagar | Bangalore | Karnataka    |  530068 | 7894562456  | ramrk@gmail.com   |
| Dani      | Don      | RajajiNagar | Bangalore | Karnataka    |  530064 | 9875641320  | ddrj123@gmail.com |
| Preeti    | Singh    | FrazerTown  | Vizag     | AndraPradesh | 4000256 | 7854695236  | psft288@gmail.com |
+-----------+----------+-------------+-----------+--------------+---------+-------------+-------------------+
3 rows in set (0.00 sec)

mysql> select * from addressbook where city = "Bangalore" or State = "Karnataka";
+-----------+----------+-------------+-----------+-----------+--------+-------------+-------------------+
| FirstName | Lastname | Address     | City      | State     | Zip    | PhoneNumber | Email
  |
+-----------+----------+-------------+-----------+-----------+--------+-------------+-------------------+
| Ram       | Kumar    | IndiraNagar | Bangalore | Karnataka | 530068 | 7894562456  | ramrk@gmail.com   |
| Dani      | Don      | RajajiNagar | Bangalore | Karnataka | 530064 | 9875641320  | ddrj123@gmail.com |
+-----------+----------+-------------+-----------+-----------+--------+-------------+-------------------+
2 rows in set (0.00 sec)

mysql> select * from addressbook where city = "vizag" or State = "AndraPraesh";
+-----------+----------+------------+-------+--------------+---------+-------------+-------------------+
| FirstName | Lastname | Address    | City  | State        | Zip     | PhoneNumber | Email
 |
+-----------+----------+------------+-------+--------------+---------+-------------+-------------------+
| Preeti    | Singh    | FrazerTown | Vizag | AndraPradesh | 4000256 | 7854695236  | psft288@gmail.com |
+-----------+----------+------------+-------+--------------+---------+-------------+-------------------+
1 row in set (0.00 sec)

mysql> select count(City) from addressbook where City = "Bangalore";
+-------------+
| count(City) |
+-------------+
|           2 |
+-------------+
1 row in set (0.00 sec)

mysql> select count(State) from addressbook where State = "AndraPradesh";
+--------------+
| count(State) |
+--------------+
|            1 |
+--------------+
1 row in set (0.00 sec)

mysql> select * from addressbook WHERE(City = "Bangalore" or State = "AndraPradesh") ORDER BY FirstName ASC;
+-----------+----------+-------------+-----------+--------------+---------+-------------+-------------------+
| FirstName | Lastname | Address     | City      | State        | Zip     | PhoneNumber | Email             |
+-----------+----------+-------------+-----------+--------------+---------+-------------+-------------------+
| Dani      | Don      | RajajiNagar | Bangalore | Karnataka    |  530064 | 9875641320  | ddrj123@gmail.com |
| Preeti    | Singh    | FrazerTown  | Vizag     | AndraPradesh | 4000256 | 7854695236  | psft288@gmail.com |
| Ram       | Kumar    | IndiraNagar | Bangalore | Karnataka    |  530068 | 7894562456  | ramrk@gmail.com   |
+-----------+----------+-------------+-----------+--------------+---------+-------------+-------------------+
3 rows in set (0.00 sec)

mysql> alter table addressbook add Type varchar(255) after Lastname ;
Query OK, 0 rows affected (0.09 sec)
Records: 0  Duplicates: 0  Warnings: 0

mysql> alter table addressbook add Name varchar(255) after Type ;
Query OK, 0 rows affected (0.04 sec)
Records: 0  Duplicates: 0  Warnings: 0

mysql> describe addressbook;
+-------------+--------------+------+-----+---------+-------+
| Field       | Type         | Null | Key | Default | Extra |
+-------------+--------------+------+-----+---------+-------+
| FirstName   | varchar(150) | YES  |     | NULL    |       |
| Lastname    | varchar(150) | YES  |     | NULL    |       |
| Type        | varchar(255) | YES  |     | NULL    |       |
| Name        | varchar(255) | YES  |     | NULL    |       |
| Address     | varchar(255) | YES  |     | NULL    |       |
| City        | varchar(255) | YES  |     | NULL    |       |
| State       | varchar(255) | YES  |     | NULL    |       |
| Zip         | int          | YES  |     | NULL    |       |
| PhoneNumber | mediumtext   | YES  |     | NULL    |       |
| Email       | varchar(255) | YES  |     | NULL    |       |
+-------------+--------------+------+-----+---------+-------+
10 rows in set (0.00 sec)

mysql> update addressbook set Type = "Family" where Firstname = "Dani";
Query OK, 1 row affected (0.06 sec)
Rows matched: 1  Changed: 1  Warnings: 0

mysql> update addressbook set Type = "Friend" where Firstname = "Ram";
Query OK, 1 row affected (0.06 sec)
Rows matched: 1  Changed: 1  Warnings: 0

mysql> update addressbook set Type = "Professional" where Firstname = "Preeti";
Query OK, 1 row affected (0.06 sec)
Rows matched: 1  Changed: 1  Warnings: 0

mysql> select * from addressbook;
+-----------+----------+--------------+------+-------------+-----------+--------------+---------+-------------+-------------------+
| FirstName | Lastname | Type         | Name | Address     | City      | State        | Zip     | PhoneNumber | Email             |
+-----------+----------+--------------+------+-------------+-----------+--------------+---------+-------------+-------------------+
| Ram       | Kumar    | Friend       | NULL | IndiraNagar | Bangalore | Karnataka    |  530068 | 7894562456  | ramrk@gmail.com   |
| Dani      | Don      | Family       | NULL | RajajiNagar | Bangalore | Karnataka    |  530064 | 9875641320  | ddrj123@gmail.com |
| Preeti    | Singh    | Professional | NULL | FrazerTown  | Vizag     | AndraPradesh | 4000256 | 7854695236  | psft288@gmail.com |
+-----------+----------+--------------+------+-------------+-----------+--------------+---------+-------------+-------------------+
3 rows in set (0.00 sec)

mysql> update addressbook set Name = "Priya" where Firstname = "Preeti";
Query OK, 1 row affected (0.05 sec)
Rows matched: 1  Changed: 1  Warnings: 0

mysql> update addressbook set Name = "Shankar" where Firstname = "Dani";
Query OK, 1 row affected (0.06 sec)
Rows matched: 1  Changed: 1  Warnings: 0

mysql> update addressbook set Name = "Bhavan" where Firstname = "Ram";
Query OK, 1 row affected (0.06 sec)
Rows matched: 1  Changed: 1  Warnings: 0

mysql> select * from addressbook;
+-----------+----------+--------------+---------+-------------+-----------+--------------+---------+-------------+-------------------+
| FirstName | Lastname | Type         | Name    | Address     | City      | State        | Zip     | PhoneNumber | Email             |
+-----------+----------+--------------+---------+-------------+-----------+--------------+---------+-------------+-------------------+
| Ram       | Kumar    | Friend       | Bhavan  | IndiraNagar | Bangalore | Karnataka    |  530068 | 7894562456  | ramrk@gmail.com   |
| Dani      | Don      | Family       | Shankar | RajajiNagar | Bangalore | Karnataka    |  530064 | 9875641320  | ddrj123@gmail.com |
| Preeti    | Singh    | Professional | Priya   | FrazerTown  | Vizag     | AndraPradesh | 4000256 | 7854695236  | psft288@gmail.com |
+-----------+----------+--------------+---------+-------------+-----------+--------------+---------+-------------+-------------------+
3 rows in set (0.00 sec)

mysql> select COUNT(Type) from addressbook where  Type = "Friend";
+-------------+
| COUNT(Type) |
+-------------+
|           1 |
+-------------+
1 row in set (0.00 sec)

mysql> select COUNT(Type) from addressbook where Type = "Family";
+-------------+
| COUNT(Type) |
+-------------+
|           1 |
+-------------+
1 row in set (0.00 sec)

mysql> select COUNT(Type) from addressbook where Type = "Professional";
+-------------+
| COUNT(Type) |
+-------------+
|           1 |
+-------------+
1 row in set (0.00 sec)